{
  "id": "CR-2026-0715-005",
  "type": "change_request",
  "from": "A84",
  "to": "A30",
  "target": "packages/ui/src/{atoms/Button,atoms/TextField,atoms/Checkbox,atoms/Alert,molecules/PasswordField,molecules/DataTable,organisms/ListCard,organisms/TodoCard,organisms/StatsCard}/** + packages/ui/src/atoms/Button/Button.stories.tsx",
  "reason": "CR-2026-0715-004 (A18 계약 확장) 의 후속 구현이다. **계약이 먼저 머지된 뒤에 착수할 것** — 순서를 뒤집으면 codegen 산출 타입과 구현이 어긋난다.\n\n[배경] MP-001 실측: packages/ui 15종이 전부 만들어져 있는데 apps/admin 은 컴포넌트를 0개 import 한다. 페이지가 15종을 전부 사본으로 다시 만들었다 (사본 18개). 그 사본들을 지우고 @tds/ui 로 교체하는 것이 목표인데, **shipped 모듈에 prop 이 부족해서 지금 교체하면 화면이 깨진다** (로그인 폼 제출 사망 · 대시보드 SPA 내비 → 전체 새로고침 · 기간 토글이 자기 클릭마다 소멸 · 매출 '원' 접미사 소실). 상세 재현 경로는 CR-004 와 docs/tds/modularization/MP-001-admin-8screens.md §3 에 있다.\n\n[요청 1 — 계약 확장분 구현] CR-004 가 ACCEPTED 되면 pnpm codegen 이 타입을 파생한다. 그 타입에 맞춰 구현 + 스토리 + **단언 있는 테스트**를 넣어 달라. 특히:\n  - Button: type prop 을 실제로 <button type={type}> 에 연결할 것. 현재 Button.tsx:45 는 type=\"button\" 하드코딩이다. **이것을 놓치면 로그인 폼 5개가 조용히 죽는다.**\n  - Button: native ButtonHTMLAttributes 패스스루 — **shipped Card 가 이미 하고 있는 것과 동일한 모양**으로 (`& Omit<ButtonHTMLAttributes, 'style'|'children'|'className'>`).\n  - ListCard/TodoCard: 클릭 콜백에 MouseEvent 를 실제로 넘길 것. 현재 ListCard.tsx:48-51 · TodoCard.tsx:23-30 이 이벤트를 삼킨다. 호출부가 preventDefault() 로 SPA 내비를 가로챌 수 있어야 한다.\n  - StatsCard: action 의 loading-언마운트를 제거할 것 (StatsCard.tsx:21 의 `&& !loading`). action 은 loading 중에도 떠 있어야 한다.\n  - DataTable: 본문 셀의 withUnit 하드코딩(DataTable.tsx:83) 을 columns[].unitInBody 로 연결할 것.\n\n[요청 2 — 축3 중복 1건 상환] A83 code-quality 축3 이 **packages/ui/src/atoms/Button/Button.stories.tsx:119 의 30줄 블록이 11곳에서 반복**된다고 잡았다 (clone:1187e2b0904678c1). apps/admin 을 제외하면 packages/ui 안의 유일한 중복이다. play 함수 보일러플레이트를 헬퍼로 추출해 달라. **테스트를 약화시키지 말 것** — A77 축4 래칫(기준선 137칸)이 후퇴를 blocker 로 잡는다. 단언은 그대로 두고 반복만 접어라.\n\n[요청 3 — CR-001/002 의 미완 후속] CR-001/002 의 resolution 이 남긴 후속이 아직 안 됐다: DataTable · LineAreaChart 의 .tsx/.test.tsx/.stories.tsx 헤더 주석이 여전히 contract.json@1.0.0 을 가리킨다 (현재 계약은 1.0.1). 그리고 근거가 사라진 `Loading` 스토리와 'loading 은 테스트 불가' 주석이 남아 있다. contract-test 는 생성물만 보므로 게이트는 통과하지만 정리 대상이다.\n\n[요청 4 — 낡은 주석 정리] packages/ui 는 아니지만 연관 사실: 페이지들이 '@tds/ui 는 아직 비어 있다 / G5 미통과' 라는 **한때 참이었던 주석**을 근거로 사본을 만들었다. packages/ui 쪽에도 같은 종류의 낡은 주석이 없는지 확인해 달라.\n\n[정직성 요구] 새 prop 의 테스트는 states 전부 + blockedWhen 전부를 **단언으로** 덮어야 한다. CR-003 의 교훈: 이름만 맞춘 빈 테스트로 커버리지 칸을 덮는 것은 초록불 위조다. 콜백 비발생은 vi.fn() 스파이 + expect(fn).not.toHaveBeenCalled() 로 증명할 것 — 렌더 단언(toBeDisabled 등)은 축3 이 커버로 세지 않는다.\n\n[A84 는 왜 직접 안 고쳤는가] packages/ui/src/** 는 A30 소유다 (orchestration/registry/agents.json). boundary:check --agent A84 가 exit 1 로 차단한다.",
  "proposed": {
    "packages/ui/src/atoms/Button/Button.tsx": "CR-004 로 확장된 계약에 맞춰 type · fullWidth · native ARIA 패스스루 구현. **type 하드코딩 제거가 최우선** (현재 :45).",
    "packages/ui/src/atoms/TextField/TextField.tsx": "name · autoComplete · inputMode · inputRef 연결.",
    "packages/ui/src/molecules/PasswordField/PasswordField.tsx": "name · autoComplete · placeholder · inputRef 연결. inputRef 가 생기면 현행 document.getElementById(id) DOM 결합을 제거할 수 있다. CR-2026-0715-003(OPEN, onBlur blockedWhen 테스트)과 같은 파일이므로 함께 처리 권장.",
    "packages/ui/src/atoms/Checkbox/Checkbox.tsx": "name 연결.",
    "packages/ui/src/atoms/Alert/Alert.tsx": "onClose · live · align 구현. 추가 판정 필요: 루트가 <p> 라 블록 자식에서 레이아웃이 붕괴한다 — <div> 로 바꿀지 A18 과 합의할 것.",
    "packages/ui/src/molecules/DataTable/DataTable.tsx": "columns[].unitInBody 를 :83 의 withUnit 에 연결. + 헤더 주석 1.0.0 → 1.0.1, 근거 사라진 Loading 스토리 정리.",
    "packages/ui/src/organisms/ListCard/ListCard.tsx": "onRowClick 에 MouseEvent 전달 (:48-51). SPA 내비가 가능해야 한다.",
    "packages/ui/src/organisms/TodoCard/TodoCard.tsx": "onItemClick 에 MouseEvent 전달 (:23-30). ListCard 와 동일 판정.",
    "packages/ui/src/organisms/StatsCard/StatsCard.tsx": "action 의 loading-언마운트 제거 (:21 의 `&& !loading`). action 은 loading 중 떠 있는 채 비활성돼야 한다.",
    "packages/ui/src/atoms/Button/Button.stories.tsx": "축3 중복 상환 — 30줄 play 보일러플레이트 11벌을 헬퍼로 추출. 단언은 보존할 것 (A77 래칫).",
    "packages/ui/src/molecules/LineAreaChart/*": "CR-001/002 후속 — 헤더 주석 1.0.0 → 1.0.1, 근거 사라진 Loading 스토리 및 'loading 테스트 불가' 주석 정리."
  },
  "impact": "MINOR",
  "blocking": false,
  "sla_hours": 2,
  "status": "OPEN"
}
