{
  "id": "CR-2026-0715-007",
  "type": "change_request",
  "from": "A84",
  "to": "A60",
  "target": "docs/tds/guidelines/reuse-decision-guide.md (신규)",
  "reason": "오너가 '재활용 판정 가이드를 docs/tds/guidelines/ 에 남겨라 — 다음 사람이 화면을 만들 때 이걸 새로 만들어야 하나, 있는 걸 써야 하나를 5분 안에 판정할 수 있어야 한다' 고 지시했다. 그런데 **docs/tds/guidelines/** 는 A60 소유다** (orchestration/registry/agents.json: A60 owns docs/tds/components/** · docs/tds/patterns/** · docs/tds/guidelines/**). A84 의 owns 는 docs/tds/modularization/** 와 reports/modularization/** 뿐이라 boundary:check --agent A84 가 exit 1 로 차단한다.\n\n그래서 A84 는 가이드를 **자기 소유 경로에 작성**해 두었다: `docs/tds/modularization/reuse-decision-guide.md`. 내용은 완성돼 있다. **A60 이 docs/tds/guidelines/ 로 편입**해 달라 (그대로 이동하거나, A60 의 문서 규격에 맞춰 다듬어도 좋다).\n\n[왜 이 가이드가 필요한가 — 실측] MP-001 전수 조사 결과, packages/ui 는 15종을 다 만들어 놓았는데 **apps/admin 은 그중 컴포넌트를 0개 import 한다**. 그 결과 15종 전부가 페이지 로컬 사본으로 다시 태어났다 (사본 18개). 그리고 그 사본들은 악의가 아니라 **'@tds/ui 는 아직 비어 있다' 는 한때 참이었던 주석**을 근거로 태어났다. 아무도 그 주석을 갱신하지 않았고, 사본은 영구화됐다. 가이드가 없으면 19번째 사본이 같은 방식으로 태어난다.\n\n[가이드의 성격] 추상적 원칙이 아니라 **이번에 실제로 내린 판정들을 사례로** 실었다 (오너 요구사항). 담긴 것:\n  - 5분 판정 플로차트 (재활용 / 승격 / 유지)\n  - 재활용 사례 4건 (TabBar→Tabs 는 계약이 TabBar 를 출처로 명시하고 있었다 · VisitorChart→LineAreaChart 는 기하 상수가 바이트 동일 · SelectAllCheckbox 사본은 aria-checked=mixed 를 빠뜨려 a11y 퇴행까지 일으켰다)\n  - **재활용의 함정** — 'packages/ui 에 있다' 와 '지금 쓸 수 있다' 는 다르다. 18건 중 7건만 즉시 교체 가능했고 11건은 계약 EXTEND 가 선행 조건이었다. 순진하게 바꿨다면 로그인 폼 5개가 제출을 멈추고, 대시보드 SPA 내비가 전체 새로고침이 되고, E2E 셀렉터가 깨졌을 것이다\n  - 승격 사례 4건 + **순서 함정** ('소비자 수' 를 셀 때 손으로 베낀 사본도 소비자다. 사본을 원본으로 되돌린 뒤 다시 세라)\n  - **스타일만 승격하면 마크업이 남는다** — filterHeadingStyle 3종은 올라갔는데 그것을 감싸는 <li><button aria-pressed> 마크업은 다섯 벌 그대로다\n  - 유지 사례 6건 + 과잉 추상화 회피 근거 (LoginHistoryTable 을 위해 파괴적 DataTable v2 를 만들지 않은 이유 — 수혜자가 1페이지뿐이다)\n  - **'계약은 소망이 아니라 현실의 기술이다'** — CR-001/002 (진입할 prop 없는 loading 상태) 의 교훈을 일반 규칙으로 승격. MP-001 에서 같은 함정이 StatsCard.action.hiddenWhen 에서 재발한 것을 사례로 추가\n  - P1 단일 소유권 — 판정한 사람과 고치는 사람이 다른 것이 정상이다 (A83 의 '측정만 한다' 와 같은 원칙)\n  - PR 전 체크리스트 6항\n\n[검토 요청] A61(Docs Reviewer, G8) 검수 대상이라면 함께 태워 달라. 사실관계는 전부 실측 기반이고 파일:라인 근거가 붙어 있다.",
  "proposed": {
    "docs/tds/guidelines/reuse-decision-guide.md": "docs/tds/modularization/reuse-decision-guide.md 를 편입한다. A84 소유 경로의 원본은 MP-001 의 부속 자료로 남겨도 되고, 중복을 피하려면 편입 후 링크만 남기고 지워도 된다 — A60 판단에 맡긴다.",
    "_crossReference": "page-module-pipeline.md ② 단계(페이지 조사·공통 모듈 후보 추출)에서 이 가이드를 참조하도록 링크를 걸면, 다음 화면을 만드는 사람이 파이프라인 문서에서 자연스럽게 도달한다.",
    "_relatedArtifacts": [
      "docs/tds/modularization/MP-001-admin-8screens.md (판정표 18+9+10건 · 근거 · 집행 순서)",
      "reports/modularization/admin-8screens-2026-07-15.json (기계 판독용)",
      "CR-2026-0715-004 (A18 계약 확장) · 005 (A30 구현) · 006 (A41 페이지 교체 + 부채 상환)"
    ]
  },
  "impact": "PATCH",
  "blocking": false,
  "sla_hours": 2,
  "status": "OPEN"
}
