{
  "id": "CR-2026-0715-004",
  "type": "change_request",
  "from": "A84",
  "to": "A18",
  "target": "contracts/{Button,TextField,PasswordField,Checkbox,Alert,DataTable,ListCard,TodoCard,StatsCard}.contract.json",
  "reason": "MP-001 (docs/tds/modularization/MP-001-admin-8screens.md) 실측 결과다. packages/ui 는 15종을 다 만들어 놓았는데 apps/admin 은 컴포넌트를 **0개** import 한다 (@tds/ui 에서 가져오는 것은 tokens.css 뿐). 그 결과 15종 전부가 페이지 로컬 사본으로 다시 태어났다 — 사본 18개. page-module-pipeline ③ 이 규정한 'G5 통과 후 페이지 로컬 구현은 모듈 소비로 교체' 단계가 실행되지 않은 것이다.\n\n[핵심 — 왜 A41 이 그냥 교체하면 안 되는가] 18건 중 **7건만 즉시 교체 가능**하고 **11건은 계약에 prop 이 없어서 교체하면 화면이 깨진다**. 오너 지시는 '확정한 화면의 보이는 동작을 바꾸지 마라' 이고 E2E 63건이 안전망이다. 실측된 파괴 목록:\n\n(1) **Button.type 부재 — 치명.** packages/ui/src/atoms/Button/Button.tsx:45 가 type=\"button\" 을 하드코딩한다. 계약에 type prop 이 없다. 재현: LoginForm.tsx:137 은 <Button type=\"submit\">, 폼은 <form onSubmit> 으로 제출된다. shipped Button 으로 바꾸면 **로그인 제출이 조용히 죽는다** (Enter 제출 포함). 같은 파괴가 RoleFormModal.tsx:65 · CreateGroupModal.tsx:154 · PasswordChangeModal.tsx:106 · PointsCard.tsx:298 — **폼 5개**.\n(2) **Button 에 native ARIA 패스스루 부재.** 현재 실사용: aria-describedby(RolePanel.tsx:129,139) · title(RolePanel.tsx:130,140) · aria-label(PointsCard.tsx:347) · aria-busy(ConfirmDialog.tsx:147). shipped 는 하나도 안 받는다 → 전부 TS 에러. 선례: shipped **Card 는 이미** `& Omit<HTMLAttributes, 'style'|'children'|'className'>` 패스스루를 갖고 있다. Button 도 같은 모양이면 된다.\n(3) **Button.fullWidth 부재** — LoginForm.tsx:139 (로그인 CTA 100% 폭).\n(4) **TextField**: name · autoComplete · inputMode · inputRef 부재 (LoginForm.tsx:90-98). autoComplete 없으면 **브라우저 자격증명 자동완성이 퇴행**한다.\n(5) **PasswordField**: name · autoComplete · placeholder · inputRef 부재 (LoginForm.tsx:106-113). autoComplete=\"current-password\" 없으면 **비밀번호 관리자 채우기가 퇴행**한다.\n(6) **Checkbox.name 부재** — LoginForm.tsx:128 (name=\"rememberEmail\", 폼 제출 키).\n(7) **Alert**: shared/ui 판본이 쓰는 onClose(닫기 버튼) · live(role 오버라이드) · align 부재. 추가로 shipped Alert 은 tone=\"danger\" 를 role=\"alert\" aria-live=\"assertive\" 에 **하드 커플링**하는데 opt-out prop 이 없다 → 지금 조용한(status) 배너들이 스크린리더를 가로챈다.\n(8) **DataTable**: 본문 셀이 withUnit=false 하드코딩 (DataTable.tsx:83). 대시보드 PeriodTable 은 본문 매출 행에 '원' 을 붙인다 → 교체하면 **접미사가 사라진다**. 필요한 것: columns[].unitInBody?: boolean (기본 false). 추가로 본문 행은 date, 요약 행은 label 로 rowKey 가 다르다 → summaryRowKey?: string (또는 A41 이 어댑터에서 흡수 — 그 경우 계약 변경 불필요).\n(9) **ListCard / TodoCard — 치명.** 클릭 콜백이 **MouseEvent 를 넘기지 않는다** (ListCard.tsx:48-51, TodoCard.tsx:23-30 은 id/key 문자열만 준다). 따라서 preventDefault() 가 불가능하다 → href 를 주면 **전체 페이지 새로고침**, 안 주면 <button> 이 되어 새탭/가운데클릭/URL 미리보기를 잃는다. 대시보드는 react-router <Link> 로 SPA 내비를 한다. **어떤 prop 조합으로도 재현할 수 없다.**\n(10) **StatsCard — 치명, 그리고 CR-001/002 와 같은 종류의 결함이다.** 계약이 props.action.hiddenWhen: [\"loading\"] 을 선언한다 → StatsCard.tsx:21 이 loading 중 action 슬롯을 **언마운트**한다. 그런데 대시보드에서 그 action 은 **기간 토글(SegmentedControl) 자신**이고 loading 은 isFetching 이다 (StatsSection.tsx:72) → **토글을 누를 때마다 토글이 사라진다** (헤더 레이아웃 점프 + 포커스 상실). 현재 로컬은 <RangeToggle disabled={loading}> 로 **떠 있는 채 비활성**된다. 계약이 현실을 잘못 기술한 사례다.\n\n[기대 결과] 아래 proposed 대로 계약이 확장되면 A30(CR-005)이 구현하고 A41(CR-006)이 페이지 사본 18개를 지운다. 그 시점에 E2E 63/63 이 유지된 채 중복이 사라진다. **순서를 뒤집으면 E2E 가 깨지고, 그것은 곧 동작을 바꿨다는 뜻이다.**\n\n[정직성 요구 — CR-001/002 의 교훈] 새로 넣는 prop 은 전부 **실제 호출부가 있는 것**뿐이다 (위 재현 경로 참조). 소망으로 넣은 표면은 없다. 반대로 StatsCard.action.hiddenWhen 은 **현실에 없는 동작을 계약이 강제**하고 있으므로 제거/수정 대상이다 — 계약은 소망이 아니라 현실의 기술이다.\n\n[A84 는 왜 직접 안 고쳤는가] contracts/** 는 A18 소유다 (orchestration/registry/agents.json). boundary:check --agent A84 가 exit 1 로 차단한다. A84 의 owns 는 docs/tds/modularization/** 와 reports/modularization/** 뿐이다.",
  "proposed": {
    "contracts/Button.contract.json": {
      "props.type": {
        "type": "enum",
        "values": ["button", "submit", "reset"],
        "default": "button",
        "figmaProperty": null,
        "description": "네이티브 button type. submit 이면 폼을 제출한다"
      },
      "props.fullWidth": {
        "type": "boolean",
        "default": false,
        "figmaProperty": "FullWidth",
        "description": "컨테이너 100% 폭"
      },
      "_nativePassthrough": "Card 계약의 선례대로 native ButtonHTMLAttributes 패스스루를 허용한다 (aria-label · aria-describedby · aria-busy · title). 계약에 prop 을 하나씩 열거하는 대신 Card 와 동일한 nativeProps 표기를 쓸 것.",
      "_defaultVariantWarning": "variant 기본값은 primary 로 유지하되, A41 이 교체 시 shared/ui 호출부(기본 secondary 기대)를 전수 감사해야 함을 계약 notes 에 명시할 것. 계약 변경은 아니지만 마이그레이션 위험 1순위다.",
      "_impact": "MINOR (prop 추가, 기존 시그니처 불변)"
    },
    "contracts/TextField.contract.json": {
      "props.name": { "type": "string", "default": "", "description": "폼 제출 키" },
      "props.autoComplete": {
        "type": "string",
        "default": "",
        "description": "브라우저 자동완성 힌트 (username · email …)"
      },
      "props.inputMode": { "type": "string", "default": "", "description": "모바일 키보드 힌트" },
      "props.inputRef": {
        "type": "slot",
        "description": "input 요소 ref — 제출 실패 시 첫 오류 필드 포커스에 필요. forwardRef 로 대체 가능하면 그쪽이 낫다"
      },
      "_errorSentinel": "현행 error?: string 은 '' 를 valid 로 읽는다. 로컬은 string|null 이고 '' 를 invalid 로 읽는다 — 의미가 반전돼 있다. A41 이 error={x ?? ''} 로 흡수하는 것으로 정리하고, 계약 description 에 '빈 문자열 = 오류 없음' 을 명시할 것 (계약 변경 불필요, 문서화만)."
    },
    "contracts/PasswordField.contract.json": {
      "props.name": { "type": "string", "default": "" },
      "props.autoComplete": {
        "type": "string",
        "default": "",
        "description": "current-password 등"
      },
      "props.placeholder": {
        "type": "string",
        "default": "",
        "description": "TextField 에는 있으나 PasswordField 로 전달되지 않는다"
      },
      "props.inputRef": {
        "type": "slot",
        "description": "현재 구현은 document.getElementById(id) 로 우회하고 있다 — ref 가 생기면 그 DOM 결합을 없앨 수 있다"
      },
      "_note": "CR-2026-0715-003 (events.onBlur.blockedWhen) 이 아직 OPEN 이다. 같은 파일을 건드리므로 두 CR 을 함께 처리하면 codegen 을 한 번만 돌리면 된다."
    },
    "contracts/Checkbox.contract.json": {
      "props.name": { "type": "string", "default": "", "description": "폼 제출 키 (rememberEmail)" }
    },
    "contracts/Alert.contract.json": {
      "props.onClose": {
        "type": "event",
        "description": "주면 닫기(×) 버튼이 나타난다. shared/ui 의 해제 가능 배너"
      },
      "props.live": {
        "type": "enum",
        "values": ["alert", "status"],
        "default": null,
        "description": "role/aria-live 를 tone 에서 분리한다. 기본값은 현행 tone 커플링 유지(danger→alert), 명시하면 오버라이드"
      },
      "props.align": { "type": "enum", "values": ["start", "center"], "default": "start" },
      "props.alertRef": {
        "type": "slot",
        "description": "제출 실패 시 배너 포커스. 대안: 호출부가 이미 id 를 넘기므로 document.getElementById(id).focus() 로 우회 가능 — 이 경우 이 prop 은 불필요하다. **A18 판단에 맡긴다**"
      },
      "_rootElement": "shipped Alert 의 루트는 <p> 다. shared/ui 호출부는 블록 자식을 넘기므로 <p> 안의 <div> = 브라우저 자동 닫기 → 레이아웃 붕괴. 루트를 <div> 로 바꾸거나(구현 변경, A30) 계약이 자식을 인라인으로 제한해야 한다. 판정 필요."
    },
    "contracts/DataTable.contract.json": {
      "props.columns[].unitInBody": {
        "type": "boolean",
        "default": false,
        "description": "본문 행에도 단위 접미사를 붙인다. 현재 본문은 withUnit=false 하드코딩이라 대시보드 매출의 '원' 이 사라진다"
      },
      "_summaryRowKey": "본문 행(date)과 요약 행(label)의 키 필드가 다르다. summaryRowKey?: string 을 추가하거나, A41 이 어댑터에서 period 필드로 통일한다. **후자면 계약 변경 불필요** — A18 이 판단할 것."
    },
    "contracts/ListCard.contract.json": {
      "events.onRowClick": {
        "payload": "(id: string, event: MouseEvent)",
        "description": "**MouseEvent 를 넘겨야 한다.** 현재는 id 만 넘겨 preventDefault() 가 불가능하고, 그래서 react-router SPA 내비를 만들 수 없다 (href 주면 전체 새로고침)"
      },
      "_alternative": "onRowClick 시그니처 변경 대신 linkAs?: ElementType 슬롯으로 <Link> 를 주입받는 방법도 있다. 어느 쪽이든 **SPA 내비가 가능해야 한다** — 현재는 어떤 prop 조합으로도 불가능하다.",
      "_impact": "onRowClick 시그니처 확장은 인자 추가라 기존 호출자 무영향 → MINOR"
    },
    "contracts/TodoCard.contract.json": {
      "events.onItemClick": {
        "payload": "(key: string, event: MouseEvent)",
        "description": "ListCard 와 동일 결함·동일 처방. 두 계약을 **같은 판정으로** 정리할 것 (CR-001/002 선례)"
      }
    },
    "contracts/StatsCard.contract.json": {
      "props.action.hiddenWhen": "**제거한다.** 현재 [\"loading\"] 이라 loading 중 액션 슬롯이 언마운트된다. 대시보드에서 그 액션은 기간 토글 자신이고 loading 은 isFetching 이므로 **토글을 누를 때마다 토글이 사라진다**. 계약이 존재하지 않는 요구사항을 강제하고 있다.",
      "_replacement": "action 은 loading 중에도 **떠 있는 채 비활성**되어야 한다 (현행 로컬 동작). SegmentedControl 은 이미 disabled 를 지원하므로, 호출부가 <SegmentedControl disabled={loading}> 를 넘기면 된다 — StatsCard 는 action 을 그대로 렌더하기만 하면 되고 새 prop 이 필요 없다. hiddenWhen 을 지우는 것으로 충분하다.",
      "_impact": "PATCH — props 시그니처 불변, 계약이 기술하던 동작이 구현/현실과 어긋난 오기(erratum)의 정정. CR-2026-0715-001/002 와 동일 논증."
    }
  },
  "impact": "MINOR",
  "blocking": true,
  "sla_hours": 2,
  "status": "OPEN"
}
