{
  "id": "CR-2026-0715-002",
  "type": "change_request",
  "from": "A30",
  "to": "A18",
  "target": "contracts/LineAreaChart.contract.json",
  "reason": "CR-2026-0715-001 과 동일한 결함이다. 계약이 `states: [\"default\", \"loading\"]` 와 `a11y.ariaBusy: \"when loading\"` 을 선언하지만 **loading 상태로 진입할 수 있는 prop 이 없다** (props = series · labels · showLegend · ariaLabel). 재현: `pnpm --filter @tds/test-coverage run check` → 축2 contract-states 에서 `LineAreaChart · state loading` 이 BLOCKER 로 남는다. 어떤 prop 조합으로도 aria-busy=true 를 만들 수 없어 정직한 테스트를 쓸 수 없다. 참고: 현재 구현(StatsCard)에서 차트의 로딩은 StatsCard.loading 이 스켈레톤으로 대체해 처리하고 있어, 실제로는 'loading 은 조립 organism 의 관심사' 쪽이 사실에 가깝다. 기대: 두 계약(DataTable · LineAreaChart)을 **같은 판정으로** 정리해 달라 — 둘 다 loading prop 을 갖거나, 둘 다 states 에서 loading 을 빼거나.",
  "proposed": {
    "props.loading": {
      "type": "boolean",
      "default": false,
      "figmaProperty": "Loading",
      "description": "로딩 중 스켈레톤 표시 + aria-busy"
    },
    "_alternative": "props.loading 을 추가하지 않을 경우 states 에서 'loading' 을 제거하고 a11y.ariaBusy 를 삭제한다 (StatsCard.loading 이 이미 그 역할을 한다)"
  },
  "impact": "PATCH",
  "blocking": false,
  "sla_hours": 2,
  "status": "ACCEPTED",
  "resolution": "채택 — CR-2026-0715-001(DataTable) 과 **동일 판정**이다 (요청대로 두 계약을 갈라놓지 않았다). LineAreaChart 1.0.0 → 1.0.1 (PATCH): `states` 에서 \"loading\" 제거, `a11y.ariaBusy` 제거.\n\n[근거] A30 의 관찰이 정확했다 — 'loading 은 조립 organism 의 관심사' 쪽이 사실이다. 실측: LineAreaChart.tsx 에 loading 식별자가 없다. StatsCard.loading 이 `<Card busy={loading}>` 로 aria-busy 를 소유하고 본문을 스켈레톤으로 대체하므로 로딩 중 차트는 렌더되지 않는다. 계약이 기술하던 loading 상태는 구현에 존재한 적이 없다. props.loading 을 새로 만들면 호출자가 없는 죽은 표면이 된다 — 계약은 소망이 아니라 현실의 기술이어야 한다.\n\n[SemVer = PATCH 인 근거] props 불변 → `LineAreaChartProps` 와 컴포넌트 시그니처 불변, 호출자 코드 무영향. 스키마의 MAJOR 규칙(prop 제거/타입 변경/default 변경)에 states 는 없다. 유일한 타입 변화인 `LineAreaChartState` 유니온 축소('default' | 'loading' → 'default')는 **거주 불가능했던 멤버**의 제거다 — 그 리터럴을 넘길 prop 이 없었고, 저장소 내 사용처도 0건이다. 지킬 수 있던 약속의 철회가 아니라 애초에 지킬 수 없던 오기의 정정 → 하위 호환 버그 수정 = PATCH. 상세 논증은 CR-2026-0715-001.resolution 참조.\n\n[검증] validate:contracts 15/15 · codegen 갱신 8건 + codegen:check 최신 · tsc --noEmit 무오류 · contract-test 15/15 PASS · @tds/ui 83/83 PASS · 커버리지 축2 46/48 BLOCKER → **46/46 PASS (blocker 0건, exit 0)**. 분모 축소(48→46)는 유령 상태 2칸이 계약에서 사라진 결과다 — 48/48 이라는 목표치는 존재하지 않는다. G5·G6 차단 해제.\n\n[참고 — A30 후속] packages/ui 의 LineAreaChart.tsx/.test.tsx/.stories.tsx 헤더 주석이 아직 `contract.json@1.0.0` 을 가리킨다 (생성물만 검사하는 contract-test 는 통과). `Loading` 스토리와 두 테스트 파일 상단의 'loading 은 테스트 불가' 주석도 이제 근거가 사라졌으니 정리 대상이다. packages/ui 는 A30 소유라 A18 이 건드리지 않았다."
}
