{
  "id": "CR-2026-0715-001",
  "type": "change_request",
  "from": "A30",
  "to": "A18",
  "target": "contracts/DataTable.contract.json",
  "reason": "계약이 `states: [\"default\", \"loading\"]` 와 `a11y.ariaBusy: \"when loading\"` 을 선언하지만, **loading 상태로 진입할 수 있는 prop 이 props 블록에 없다** (columns · rows · rowKey · summaryRows · caption · dimZero · empty). 재현: `pnpm --filter @tds/test-coverage run check` → 축2 contract-states 에서 `DataTable · state loading` 이 BLOCKER 로 남는다. 어떤 prop 조합으로도 aria-busy=true 를 만들 수 없으므로 이 상태를 검증하는 테스트를 **정직하게 작성할 수 없다** (이름만 맞춘 빈 테스트로 덮는 것은 A77이 고발한 초록불 위조다). 기대: loading prop 이 추가되면 `DataTable: loading 상태 — aria-busy=true` 테스트를 즉시 작성한다. 대안: 로딩은 조립하는 organism(StatsCard.loading)이 소유하는 관심사라고 판단되면 states 에서 loading 을 제거하고 a11y.ariaBusy 도 함께 지운다 — 어느 쪽이든 계약과 구현이 일치해야 한다. A30 은 계약에 없는 prop 을 만들 수 없으므로(SKILL 하드 바운더리) 이 판정은 A18/A19 의 몫이다.",
  "proposed": {
    "props.loading": {
      "type": "boolean",
      "default": false,
      "figmaProperty": "Loading",
      "description": "로딩 중 스켈레톤 행 표시 + aria-busy"
    },
    "_alternative": "props.loading 을 추가하지 않을 경우 states 에서 'loading' 을 제거하고 a11y.ariaBusy 를 삭제한다 (로딩은 조립 organism 의 관심사)"
  },
  "impact": "PATCH",
  "blocking": false,
  "sla_hours": 2,
  "status": "ACCEPTED",
  "resolution": "채택 — 단, `proposed.props.loading` 이 아니라 `proposed._alternative` 쪽이다. DataTable 1.0.0 → 1.0.1 (PATCH): `states` 에서 \"loading\" 제거, `a11y.ariaBusy` 제거. CR-2026-0715-002(LineAreaChart) 와 동일 판정이다.\n\n[왜 prop 추가가 아니라 제거인가] 실측: DataTable.tsx 에는 loading 이라는 식별자가 아예 없다. 로딩은 조립 organism 이 소유한다 — StatsCard.loading 이 `<Card busy={loading}>` 로 aria-busy 를 걸고 본문을 스켈레톤으로 **대체**하므로, 로딩 중 DataTable 은 아예 렌더되지 않는다. 즉 계약이 기술하던 loading 상태는 구현에 존재한 적이 없다. 여기서 props.loading 을 추가하면 아무도 호출하지 않는 죽은 표면이 생긴다. 계약은 소망이 아니라 현실의 기술이어야 한다. 실제로 컴포넌트 자체가 로딩을 소유해야 하는 날이 오면 그때 prop 을 MINOR 로 추가한다.\n\n[SemVer = PATCH 인 근거] (1) props 블록이 불변이므로 `DataTableProps` 와 React 컴포넌트 시그니처가 그대로다 — 호출자 코드는 한 줄도 깨지지 않는다. (2) 스키마의 MAJOR 규칙(`prop 제거/타입 변경/default 변경`)은 props 표면을 열거한 것이고 states 는 그 목록에 없다. (3) codegen 이 파생하는 `DataTableState` 유니온이 `'default' | 'loading'` → `'default'` 로 좁아지는 것이 유일한 타입 표면 변화다. 형식만 보면 export 된 유니온의 축소지만, 이 멤버는 **거주 불가능(uninhabitable)** 했다: 'loading' 을 받아 줄 prop 이 없어 그 리터럴을 DataTable 에 전달할 방법이 애초에 없었다. 저장소 전체 grep 결과 `DataTableState` 를 값으로 사용하는 코드는 0건이다. 따라서 이것은 지킬 수 있던 약속의 철회가 아니라 **처음부터 지킬 수 없던 오기(erratum)의 정정** — SemVer 정의상 하위 호환 버그 수정 = PATCH. (status 가 beta 인 점도 같은 방향이다.)\n\n[검증] pnpm validate:contracts 15/15 통과 · pnpm codegen (갱신 8건) + codegen:check 최신 · tsc --noEmit 무오류 · contract-test 15/15 PASS · @tds/ui 테스트 83/83 PASS · 커버리지 축2 contract-states 46/48 BLOCKER → **46/46 PASS (blocker 0건, exit 0)**. 분모가 48→46 으로 줄어든 것은 유령 상태 2칸이 계약에서 사라졌기 때문이다 — 도달할 48/48 은 존재하지 않는다. G5·G6 차단 해제.\n\n[참고 — A30 후속] packages/ui 의 DataTable.tsx/.test.tsx/.stories.tsx 헤더 주석이 아직 `contract.json@1.0.0` 을 가리킨다. contract-test 의 세대 검사는 생성물(generated/types)만 보므로 게이트는 통과하지만, 주석은 1.0.1 로 맞추는 편이 좋다 (packages/ui 는 A30 소유라 A18 이 건드리지 않았다). DataTable.stories.tsx 의 `Loading` 스토리도 이제 계약상 근거가 없으니 정리 대상이다."
}
