{
  "id": "CR-2026-0715-006",
  "type": "change_request",
  "from": "A84",
  "to": "A41",
  "target": "apps/admin/src/** (페이지 로컬 사본 18개 삭제 + code-quality 축3/축4 위반 9건 상환)",
  "reason": "MP-001 (docs/tds/modularization/MP-001-admin-8screens.md) 의 집행 지시서다. A84 는 계획만 낸다 — 집행은 A41 이다 (SKILL 하드 바운더리 · P1 단일 소유권. apps/*/src/** 는 A40/A41 소유이고 boundary:check --agent A84 가 exit 1 로 차단한다).\n\n[핵심 사실] packages/ui 는 15종을 다 만들어 놓았는데 **apps/admin 은 @tds/ui 에서 컴포넌트를 0개 import 한다** (가져오는 것은 tokens.css 뿐). 그래서 15종 전부가 페이지 사본으로 다시 태어났다 — 사본 18개. page-module-pipeline ③ 의 '교체' 단계가 실행되지 않았다.\n\n[왜 이렇게 됐나 — 재발 방지가 중요하다] 페이지들이 스스로 이유를 적어 놓았고 **그 이유는 지금 전부 거짓이다**: LoginPage.tsx:6 '@tds/ui에는 아직 승인된 컴포넌트 계약이 없다(G3 미통과)' · ProductRegistrationPage.tsx:7 '@tds/ui는 아직 비어 있다' · shared/ui/Button.tsx:3 'Button 은 아직 G5 미통과라 import 하지 않는다' · dashboard/components/Card.tsx:4 '승격되면 여기 구현은 지워진다'. 계약 15종은 존재하고 contract-test 15/15 PASS 다. **교체하면서 이 낡은 주석들을 반드시 지워라** — 안 지우면 다음 사람이 같은 근거로 19번째 사본을 만든다.\n\n[작업 A — 지금 즉시 착수 가능. 계약을 기다리지 마라]\n이 항목들은 CR-004/005 와 **무관하게** 오늘 할 수 있고, 이것만으로 **축3 중복 7→2, 축4 복잡도 3→0** 이 된다:\n\n  A-1. **TriStateCheckbox 재활용 (중복 1건 + a11y 퇴행 동시 해결).** MembersTable.tsx:67-99 와 AdminsTable.tsx:50-82 가 `SelectAllCheckbox` 를 손으로 다시 짰다 — 이것이 A83 이 잡은 clone:f8657271fc8e9492 (두 파일이 문자열 2개만 빼고 동일) 의 정체다. **같은 앱의 shared/ui/TriStateCheckbox 가 이미 정확히 그 위젯이다.** 게다가 두 사본은 `aria-checked=\"mixed\"` 를 **누락**했다 (TriStateCheckbox 는 낸다) — 단순 중복이 아니라 a11y 퇴행이다. 두 테이블이 배럴에서 import 하게 하고 사본을 지워라. **새로 만들 것 없음.**\n  A-2. **좌측 패널 껍데기 스타일 승격 (중복 1건).** AdminGroupPanel.tsx:22-47 ↔ RolePanel.tsx:25-37,78-89 의 wrapperStyle · navStyle · noticeStyle 3종이 동일하다. shared/ui/styles.ts 로 올려라 — filterHeadingStyle 선례 그대로. **주의**: 같은 클론 윈도에 걸린 AdminGroupPanel.noticeStyle(하단 공지, border-top) 과 RolePanel.actionsStyle(상단 액션바, border-bottom) 은 **다른 것**이다. 토큰 모양이 닮아서 검출기에 걸렸을 뿐 변경 축이 다르다. **합치지 마라.**\n  A-3. **admins/fixtures.ts:25,37,49** — 픽스처 3벌 → 팩토리 함수.\n  A-4. **ProductRegistrationPage.tsx:471 ↔ 512** — 폼 섹션 2벌 → 페이지 내부 추출. **승격하지 마라** (소비자 1).\n  A-5. **nav-config.ts:72↔192, 79↔162** — 내비 트리 정의 중복 → 데이터 테이블화.\n  A-6. **복잡도 24 — ProductRegistrationForm (ProductRegistrationPage.tsx:117).** 최대치다. 폼 섹션별 하위 컴포넌트 + 검증 룩업 테이블로 분해.\n  A-7. **복잡도 18 — DashboardPage (DashboardPage.tsx:65).** 18개 분기 실측: 권한/탭 해소 6 + 렌더 게이팅 5 + 탭 패널 6. `useDashboardTabs()` 훅 추출만으로 **18→12**, `<DashboardTabPanel>` 까지 하면 **18→6**. 훅은 PermissionProvider 상대로 단위 테스트가 가능해진다 (지금 페이지는 불가).\n  A-8. **복잡도 16 — useUnsavedChangesDialog.handleClick (:83).** 15개 분기 = 클릭 자격(7) + 앵커 판별(5) + 목적지 판별(3). 순수 헬퍼 3개로 분해하면 **16→5**: `isPlainLeftClick(event)` · `routableAnchorFrom(target)` · `internalDestination(anchor)`. 부수 효과: :93 의 `anchor.target.length > 0 && anchor.target !== '_self'` 는 `anchor.target !== ''` 하나로 접힌다 (분기 1개 소멸). 세 헬퍼는 훅을 마운트하지 않고 단위 테스트할 수 있다 — 지금은 15개 조건 중 하나도 격리 테스트가 안 된다.\n\n[작업 B — CR-004(A18 계약) → CR-005(A30 구현) 이 머지된 뒤에만 착수]\n사본 18개를 @tds/ui import 로 교체한다. **7건은 계약 없이도 오늘 교체 가능**하다:\n  즉시 가능: shared/ui/Card · dashboard/Card · dashboard/CountBadge(→Badge) · dashboard/TabBar(→Tabs) · admins/AdminTabs(→Tabs) · dashboard/RangeToggle(→SegmentedControl) · dashboard/VisitorChart(→LineAreaChart)\n  계약 대기: login/{Button,TextField,PasswordField,Checkbox,Alert} · shared/ui/{Button,Alert} · dashboard/{PeriodTable,ListCard,TodoCard,StatsSection 내부}\n\n[🛑 회귀 위험 — 반드시 읽어라. 이걸 모르고 교체하면 화면이 깨진다]\n  1. **Button 기본 variant 뒤집힘.** 로컬 shared/ui/Button 기본은 secondary, shipped 는 primary. **variant 를 생략한 모든 호출부가 흰 보조버튼 → 파란 주버튼으로 조용히 바뀐다.** 전수 감사할 것. 마이그레이션 위험 1순위다.\n  2. **Button.type.** shipped 는 type=\"button\" 하드코딩 → 폼 5개(LoginForm · RoleFormModal · CreateGroupModal · PasswordChangeModal · PointsCard)가 제출을 멈춘다. CR-005 가 고친 뒤에만 교체.\n  3. **TextField 의 error 센티널 반전.** 로컬은 error='' 를 invalid 로, shipped 는 valid 로 읽는다. 로컬 타입은 string|null → shipped string 에 대입 불가. **모든 호출부에 error={x ?? ''} 필요.**\n  4. **E2E 셀렉터 파괴 지점**: shipped TextField 가 required 일 때 라벨에 `*` 마커를 주입 → 라벨 textContent 가 '이메일*' → `getByLabelText('이메일')` 정확일치가 깨진다. 그리고 shipped 는 aria-invalid/aria-busy 를 false 일 때 **생략**하는데 로컬은 항상 렌더 → `[aria-invalid=\"false\"]` 셀렉터가 깨진다.\n  5. **CSS 훅 소멸**: login.css 의 .tds-login-* 과 ui.css 의 .tds-ui-btn-* 규칙이 shipped 의 .tds-button--* 로 바뀌면서 죽는다. 죽은 CSS 규칙도 함께 지워라 (안 지우면 축5 죽은 코드가 0에서 올라간다).\n  6. **사본 삭제까지가 1건이다.** 교체만 하고 사본을 남기면 A75 중복률 SLO(≤3%) 위반이고 축5 죽은 코드가 0 → n 이 된다. A41/A30 이 어렵게 0으로 만든 값이다.\n\n[검증 — 교체 1건당 1커밋, 커밋마다 돌려라]\n  pnpm e2e  ← **63/63. 이것이 '동작을 안 바꿨다' 는 유일한 기계 증명이다.** 하나라도 깨지면 동작을 바꾼 것이다.\n  pnpm test (162 유지) · pnpm quality:check (중복/복잡도 감소 · blocker 0) · pnpm coverage:check (축4 래칫 137칸 이상)\n  pnpm --filter @tds/admin run build — **번들은 감소해야 한다** (사본 삭제분). 증가하면 사본이 남은 것이다. 기준선: JS 482.03 kB (gzip 146.51) · CSS 17.30 kB.\n\n[하지 마라] eslint-disable 금지. 테스트 삭제·약화 금지 (A77 축4 래칫이 blocker 로 잡는다). 오너가 확정한 UI 를 '더 낫게' 바꾸지 마라 — 이건 리팩터지 재설계가 아니다.\n\n[기준선 — A84 는 소스를 한 줄도 바꾸지 않았다]\n  e2e 63/63 PASS · test 162 PASS · contract-test 15/15 PASS · coverage blocker 0 (축4 137칸) · quality blocker 0 · major 10 (중복 7 · 복잡도 3) · naming 0 · boundary PASS · codegen 멱등(동일 63)",
  "proposed": {
    "_workA_noContractNeeded": {
      "apps/admin/src/pages/members/components/MembersTable.tsx": "SelectAllCheckbox 사본 삭제 → shared/ui 의 TriStateCheckbox 를 배럴에서 import. aria-checked=mixed 회복.",
      "apps/admin/src/pages/admins/components/AdminsTable.tsx": "동일.",
      "apps/admin/src/shared/ui/styles.ts": "패널 껍데기 스타일 3종(wrapperStyle · navStyle · noticeStyle) 승격 — filterHeadingStyle 선례. AdminGroupPanel/RolePanel 이 소비.",
      "apps/admin/src/pages/admins/fixtures.ts": "픽스처 3벌 → 팩토리.",
      "apps/admin/src/pages/product-registration/ProductRegistrationPage.tsx": "폼 섹션 2벌 → 내부 추출 + ProductRegistrationForm 복잡도 24 → ≤15 분해.",
      "apps/admin/src/shared/layout/nav-config.ts": "내비 정의 중복 2건 → 데이터화.",
      "apps/admin/src/pages/dashboard/DashboardPage.tsx": "useDashboardTabs() 훅 + <DashboardTabPanel> 추출 → 복잡도 18 → 6.",
      "apps/admin/src/shared/ui/useUnsavedChangesDialog.tsx": "isPlainLeftClick / routableAnchorFrom / internalDestination 순수 헬퍼 3개 → 복잡도 16 → 5."
    },
    "_workB_afterContracts": {
      "immediate": "shared/ui/Card · dashboard/Card · dashboard/CountBadge → Badge · dashboard/TabBar → Tabs · admins/AdminTabs → Tabs · dashboard/RangeToggle → SegmentedControl · dashboard/VisitorChart → LineAreaChart (계약 변경 불필요 — 7건)",
      "blocked": "login/{Button,TextField,PasswordField,Checkbox,Alert} · shared/ui/{Button,Alert} · dashboard/{PeriodTable,ListCard,TodoCard,StatsSection} — CR-004/005 머지 후 (11건)",
      "deleteStaleComments": "LoginPage.tsx:6 · ProductRegistrationPage.tsx:7 · shared/ui/Button.tsx:3 · dashboard/components/Card.tsx:4 · product-registration/{types.ts:4,ui.tsx:3} 의 '@tds/ui 는 아직 비어 있다 / G5 미통과' 주석 전부 삭제. 또한 permissions/icons.tsx:3 의 '연필·휴지통은 pages/members/icons.tsx 의 것을 재사용한다' 는 **사실이 아니다** (실제로는 shared/ui 에서 가져온다) — 존재하지 않는 위반을 기술해 다음 사람을 오도한다. 삭제할 것."
    },
    "_doNotPromote": "LoginHistoryTable(소비자 1 — DataTable v2 파괴적 변경이 필요한데 수혜자가 1페이지뿐) · RowIcon(도메인 어휘) · ActionMenu(소비자 1) · 내보내기 버튼(Button + DownloadIcon + 라벨 삼항 = 3줄, 모듈 아님). 과잉 추상화 금지."
  },
  "impact": "MINOR",
  "blocking": false,
  "sla_hours": 2,
  "status": "OPEN"
}
